title,summary,year,genre,director,cast,duration,language,poster_url,country
Africa Blood and Guts,"A chronicle of the violence that occurred in much of the African continent throughout the 1960s. As many African countries were transitioning from colonial rule to other forms of government, violent political upheavals were frequent. Revolutions in Zanzibar and Kenya in which thousands were killed are shown, the violence not only political; there is also extensive footage of hunters and poachers slaughtering different types of wild animals.",1966,Documentary,Gualtiero Jacopetti,"Sergio Rossi, Jomo Kenyatta, Gualtiero Jacopetti, Julius Nyerere, Moïse Kapenda Tshombe",138,it,https://image.tmdb.org/t/p/w500/fPLzCid2gk7eOCrYlXIBU24bTpO.jpg,IT
Countdown: Taylor vs. Serrano,"Two elite boxers, Katie Taylor and Amanda Serrano, prepare for their epic trilogy finale, a live-streamed match on Netflix July 11. Uma Thurman narrates their rigorous training journey.",2025,Documentary,,"Katie Taylor, Amanda Serrano, Uma Thurman, Jake Paul",49,en,https://image.tmdb.org/t/p/w500/lFsLbXGuMiH9ZAYy3O22ccwDsDH.jpg,US
Jurassic World Rebirth: The Making of a New Era,"A behind-the-scenes look with the cast and crew, featuring thrilling locations, deadly new dinosaurs and the next evolution of the iconic franchise.",2025,Documentary,,"Scarlett Johansson, Jonathan Bailey, Mahershala Ali, Gareth Edwards, David Koepp",22,en,https://image.tmdb.org/t/p/w500/uJUzfTtbCUG1GXmVS24h8h0hXX3.jpg,US
Jurassic Greatest Moments: Jurassic Park to Jurassic World,"Join the cast of ""Jurassic World Dominion"" as they relive their favorite unforgettable, action-packed and epic moments from the ""Jurassic World"" franchise.",2022,Documentary,,"Sam Neill, Laura Dern, Jeff Goldblum, Bryce Dallas Howard, Chris Pratt",44,en,https://image.tmdb.org/t/p/w500/tPdsrxdJBBIvJi5rwcnYGUoPAai.jpg,"GB, US"
Trainwreck: Poop Cruise,"An engine fire leaves 4,000 passengers stranded at sea without power and plumbing in this wild documentary about the infamous ""poop cruise"" of 2013.",2025,Documentary,James Ross,"Frank Spagnoletti, Devin Marble, Kalin Lamm, Ashley Lamm, Jayme Lamm",55,en,https://image.tmdb.org/t/p/w500/nJZlsBpDxx3LrGwXvwXkQyVnp9A.jpg,"GB, US"
Super/Man: The Christopher Reeve Story,"Christopher Reeve portrayed the Man of Steel in four Superman films and played dozens of other roles that displayed his talent and range as an actor, before being injured in a near-fatal horse-riding accident in 1995 that left him paralyzed from the neck down. After becoming a quadriplegic, he became a charismatic leader and activist in the quest to find a cure for spinal cord injuries, as well as a passionate advocate for disability rights and care.",2024,Documentary,Ian Bonhôte,"Will Reeve, Alexandra Reeve Givens, Gae Exton, Glenn Close, Jeff Daniels",104,en,https://image.tmdb.org/t/p/w500/73WchlI0Hj4HQd0T2KOztKquOek.jpg,"US, GB"
Ronnie Coleman: The King,"Ronnie Coleman is known as ""The King"" and for good reason. He is the 8x Mr. Olympia champion in the world of bodybuilding - sharing the world record for most Olympia wins. Now retired, he has undergone over 6 surgeries leaving him unable to walk without crutches but his desire to train like a pro bodybuilder has not dissipated. Exploring the history of his career as a bodybuilding legend and following his journey to recovery; for the first time ever discover the true man behind The King.",2018,Documentary,Vlad Yudin,"Ronnie Coleman, Jay Cutler, Shawn Ray, Kai Greene, Victor Martinez",93,en,https://image.tmdb.org/t/p/w500/hh8PTJdrYKX5wo50DOipH5yvxYR.jpg,US
Goodbye Horses: The Many Lives of Q Lazzarus,"A feature documentary about the life and music of singer-songwriter Diane Luckey, also known as Q Lazzarus. Q sang the hit song 'Goodbye Horses', which appeared in the Jonathan Demme films Married to the Mob and Silence of the Lambs, and had a brief moment of fame in the late 1980s/early 1990s before mysteriously disappearing for 25 years.",2025,Documentary,Eva Aridjis,"Q Lazzarus, Eva Aridjis, Jon Bouillot, Rick Duce, James Luckey Lange",103,en,https://image.tmdb.org/t/p/w500/yLiXDvICjYV8XVlQtDnhNGt5QS4.jpg,
Grenfell: Uncovered,"Survivors, witnesses, and experts tell the story of the tragic fire that engulfed a residential tower block in London — and the investigation that ensued.",2025,Documentary,Olaide Sadiq,"David Cameron, Theresa May",101,en,https://image.tmdb.org/t/p/w500/acbYuv9ZuO0Rvwi2QV8wQe7e1UP.jpg,GB
Elon Musk: The Real Life Iron Man,"Discover the meteoric rise of Elon Musk, the man who is transforming the way we think about travel technology through electric cars, the Hyperloop, and revolutionary ideas on how we live through artificial intelligence and colonizing Mars.",2018,Documentary,Sonia Anderson,"Elon Musk, Amber Heard",71,en,https://image.tmdb.org/t/p/w500/cksDBstIK9jt72vsy6vyrlBqsDg.jpg,"GB, US"
In the Shadow of the Vampire: The Making of Interview with the Vampire,"A behind-the-scenes documentary of the 1994 film, Interview with the Vampire.",2000,Documentary,,"Neil Jordan, Anne Rice, Stephen Rea, Kirsten Dunst, Stan Winston",30,en,https://image.tmdb.org/t/p/w500/jbVPk2hl8fA2IkgtfdubPYczeRg.jpg,US
X-Rated: The Greatest Adult Movies of All Time,"The evolution of adult cinema through the most influential films in history, a journey that begins in the 1970s and ends nowadays. An in-depth analysis of the success of the most prestigious erotic films, their impact on industry and society, and their influence on cinema and contemporary culture.",2015,Documentary,Eli Cross,"Chanel Preston, Christy Canyon, Georgina Spelvin, Janine Lindemulder, Jenna Jameson",94,en,https://image.tmdb.org/t/p/w500/1UgdqTHgwNivULiZvNcJ0Mj3skl.jpg,US
'Klute' in New York,"A closer look at the making of ""Klute"" (1971). The project follows the complex shooting on multiple locations in New York with major stars Jane Fonda and Donald Sutherland, under the direction of Alan J. Pakula. The two actors and the director share a little about their perspectives on the film and the experience of being part of it.",1971,Documentary,Elliot Geisinger,"Jane Fonda, Rita Gam, Alan J. Pakula, Donald Sutherland, Gordon Willis",8,en,https://image.tmdb.org/t/p/w500/6ZrChSiC45GFGqCzp7a2dJhtOeS.jpg,US
Pornocracy: The New Sex Multinationals,Never before have we watched as much porn as today yet the traditional porn industry is dying. The arrival of web sites showing amateur clips has transformed the way porn is made and consumed. Behind this transformation lies one opaque multinational.,2017,Documentary,Ovidie,"Arwen Gold, Stoya, Alina Henessy, Julia Grandi, Ovidie",77,fr,https://image.tmdb.org/t/p/w500/kfa1KHSaewjv9sSrrHDdWNdroyv.jpg,FR
Dangerous Stripper,"Approximately half a year after the strip debut that shook Japan, the original strip movie realized in collaboration with SOD and Asakusa Rockza is completely recorded. In addition to the bewitching stage at Rockza, a passionate strip image in the sun will be unveiled for the first time! There is no doubt that it will be the biggest shocking work in 2010! [* This work is an image video] [* Bonus footage, bonus images, etc. are not included]",2010,Documentary,Hiroshi Kashiwakura,Minako Komukai,60,ja,https://image.tmdb.org/t/p/w500/kKdoC2sdRDhNBXJxSkX76d0uRNn.jpg,JP
Oh La La Pauline!,"It starts like a fairy tale: there is a queen, a king and their beautiful children, Pauline, Anaïs and Guillaume.  But it's a little more complicated than that actually ...",2015,Documentary,Émilie Brisavoine,,88,fr,https://image.tmdb.org/t/p/w500/8yTWdD87dhRufW7Ixb1PDk4Mj5P.jpg,FR
Beyond Gay: The Politics of Pride,"Over the course of a year, film follows Vancouver Pride Society president Ken Coolen to various international Pride events, including Poland, Hungary, Russia, Sri Lanka and others where there is great opposition to pride parades. In North America, Pride is complicated by commercialization and a sense that the festivals are turning away from their political roots toward tourism, party promotion and entertainment. Christie documents the ways larger, more mainstream Pride events have supported the global Pride movement and how human rights components are being added to more established events. In the New York sequence, leaders organize an alternative Pride parade, the Drag March, set up to protest the corporatization of New York Pride. A parade in São Paulo, the world's largest Pride festival, itself includes a completely empty float, meant to symbolize all those lost to HIV and to anti-gay violence.",2010,Documentary,Bob Christie,"Ken Coolen, Gilbert Baker",87,en,https://image.tmdb.org/t/p/w500/7rPGoFpYF7zQ3aa7zeDpaOI8Kwl.jpg,CA
Hot Girls Wanted,A first-ever look at the realities of the professional “amateur” porn world and the steady stream of 18-to-19-year old girls entering into it.,2015,Documentary,Ronna Gradus,"Stella May, Brian Omally, Ava Taylor, John Anthony, Kelly Silguero",84,en,https://image.tmdb.org/t/p/w500/75ot83QOkc02vujyzmIbumQCU6Y.jpg,US
Amityville: Horror or Hoax,Explores the controversy surrounding the supposed haunting of Amityville's most famous house.,2000,Documentary,Daniel Farrands,"David Ackroyd, Arthur Kent, George Lutz, George Lutz, Kathy Lutz",42,en,https://image.tmdb.org/t/p/w500/onEEhBLj5wpivmI3yT74K5SbSO3.jpg,US
The Kim Kardashian Diamond Heist,"A look back at the robbery that targeted Kim Kardashian, during which she was gagged and robbed of $9 million worth of jewelry.",2025,Documentary,,Kim Kardashian,45,en,https://image.tmdb.org/t/p/w500/eg8M782cw6Sfj8OLSWo0kgYMA6e.jpg,GB
Titanic: The Digital Resurrection,"Using cutting-edge scanning technology and state-of-the-art CGI, a team of experts creates the first high-resolution 3D digital twin of the Titanic wreck. Through a groundbreaking immersive investigation, they uncover the ship’s final moments, shedding light on the acts of heroism and cowardice aboard—and revealing the true story behind the sinking of the “unsinkable” ship.",2025,Documentary,Fergus Colville,"Josh Goodman, Parks Stephenson, Jennifer Hooper, Chris Hearn, Yasmin Khan",69,en,https://image.tmdb.org/t/p/w500/wkK7w1XufrVL7qd4UzKyv0X6Gur.jpg,
La strana coppia. Incontro con Age e Scarpelli,Documentary about Italian screenwriting legends Agenore 'Age' Incrocci and Furio Scarpelli.,2001,Documentary,Paolo Virzì,"Agenore Incrocci, Furio Scarpelli, Alessio Accardo, Francesca Archibugi, Roberto Benigni",54,it,https://image.tmdb.org/t/p/w500/hmO6DH1GvYBsDJGAMfIK9THxNOD.jpg,IT
Jokōsei torio: seikan shiken,"Three high school girls. One is experienced, one has fantasies and one is curious. What more will they learn before graduation?",1977,Drama,Nobuaki Shirai,"Kei Ogawa, Asami Morikawa, Nana Asada, Masataka Naruse, Kōji Yashiro",73,ja,https://image.tmdb.org/t/p/w500/9GSLrU0aoR6Pi2FQ0ttXV2thSxJ.jpg,JP
My Fault,"Noah must leave her city, boyfriend, and friends to move into William Leister's mansion, the flashy and wealthy husband of her mother Rafaela. As a proud and independent 17 year old, Noah resists living in a mansion surrounded by luxury. However, it is there where she meets Nick, her new stepbrother, and the clash of their strong personalities becomes evident from the very beginning.",2023,Drama,Domingo González,"Nicole Wallace, Gabriel Guevara, Marta Hazas, Iván Sánchez, Eva Ruiz",117,es,https://image.tmdb.org/t/p/w500/w46Vw536HwNnEzOa7J24YH9DPRS.jpg,ES
Belyas,"Audrey Avila, Denise Esteban and Dani Yoshida star as sultry Belyas. A housewife who is tired of her controlling husband takes a different turn when two young prostitutes rent their apartment. As she befriends the two, she begins to admire the sexual freedom they have.",2025,Drama,G.B. Sampedro,"Audrey Avila, Dani Yoshida, Denise Esteban, Matthew Francisco, JD Aguas",70,tl,https://image.tmdb.org/t/p/w500/zPIaNQaQKtCIOs95x4GmaJ6omco.jpg,PH
Your Fault,The love between Noah and Nick seems unwavering despite their parents' attempts to separate them. But his job and her entry into college open up their lives to new relationships that will shake the foundations of both their relationship and the Leister family itself.,2024,Drama,Domingo González,"Nicole Wallace, Gabriel Guevara, Marta Hazas, Iván Sánchez, Eva Ruiz",118,es,https://image.tmdb.org/t/p/w500/1sQA7lfcF9yUyoLYC0e6Zo3jmxE.jpg,"ES, US"
The Substance,"A fading celebrity decides to use a black market drug, a cell-replicating substance that temporarily creates a younger, better version of herself.",2024,Drama,Coralie Fargeat,"Demi Moore, Margaret Qualley, Dennis Quaid, Edward Hamilton-Clark, Gore Abrams",141,en,https://image.tmdb.org/t/p/w500/q6HjZlvyKxYmhlRhnnxeyudzK9A.jpg,"FR, GB, US"
365 Days: This Day,"Laura and Massimo are back and hotter than ever. But the reunited couple's new beginning is complicated by Massimo’s family ties and a mysterious man who enters Laura’s life to win her heart and trust, at any cost.",2022,Drama,Barbara Białowąs,"Anna-Maria Sieklucka, Michele Morrone, Simone Susinna, Magdalena Lamparska, Otar Saralidze",111,pl,https://image.tmdb.org/t/p/w500/7qU0SOVcQ8BTJLodcAlulUAG16C.jpg,PL
My Fault: London,"18-year-old Noah moves from America to London, with her mother who's recently fallen in love with William, a wealthy British businessman. Noah meets William’s son, bad-boy Nick, and soon discovers there is an attraction between them neither can avoid. As Noah spends the summer adjusting to her new life, her devastating past will catch up with her while falling in love for the first time.",2025,Drama,Dani Girdwood,"Asha Banks, Matthew Broome, Eve Macklin, Ray Fearon, Enva Lewis",118,en,https://image.tmdb.org/t/p/w500/ttN5D6GKOwKWHmCzDGctAvaNMAi.jpg,"ES, GB, US"
Female Teacher: In Front of the Students,"The lovely Reiko has taken a new teaching job at a creepy old high school.  She is an extremely attractive woman and the young students in her class have fallen for her.  One night, after tennis practice, she is brutally assaulted in the locker room shower by a man with a stocking over his face.  Left on the floor naked and in shock, she discovers a single puzzle piece left behind by the crazed man.  A few days later, a pair of students enact a perverted sexual revenge on Reiko for kicking someone off the tennis team.  Could one of these students be the man who brutalized her in the locker room?  Who owns the strange puzzle piece?  As the mystery unfolds, Reiko must come to terms with her own sexual urges and fate.",1982,Drama,Yasuaki Uegaki,"Rushia Santô, Rina Oka, Kyôko Sagami, Toshiyuki Kitami, Toru Nakane",69,ja,https://image.tmdb.org/t/p/w500/ilMXOocCCwPWCcDLLa6M0ga8vWt.jpg,JP
Intimacy,"Failed musician Jay abandoned his family and now earns a living as head bartender in a trendy London pub. Every Wednesday afternoon, a woman comes to his house for graphic, almost wordless, sex. One day, Jay follows her and learns about her. This eventually disrupts their relationship.",2001,Drama,Patrice Chéreau,"Mark Rylance, Kerry Fox, Susannah Harker, Alastair Galbraith, Philippe Calvario",119,en,https://image.tmdb.org/t/p/w500/I0mlv1FahaLJqu2ByffMXEn4NN.jpg,"FR, DE, IT"
Titanic,"101-year-old Rose DeWitt Bukater tells the story of her life aboard the Titanic, 84 years later. A young Rose boards the ship with her mother and fiancé. Meanwhile, Jack Dawson and Fabrizio De Rossi win third-class tickets aboard the ship. Rose tells the whole story from Titanic's departure through to its death—on its first and last voyage—on April 15, 1912.",1997,Drama,James Cameron,"Leonardo DiCaprio, Kate Winslet, Billy Zane, Kathy Bates, Frances Fisher",194,en,https://image.tmdb.org/t/p/w500/9xjZS2rlVxm8SFx8kPC3aIGCOYQ.jpg,US
Hollywood Dream,"Anya is sent under a contract to Los Angeles to work in a modeling agency. Waking up after a party, she finds a bloody knife in her hands. She is suspected of a crime, but unraveling the secrets of the young model will not be easy at all.",2022,Drama,Olga Land,"Anna Doynikova, Svetlana Efremova, Ilia Volok, Ekaterina Guseva, Igor Jijikine",0,ru,https://image.tmdb.org/t/p/w500/f1zXTHhVUvg6QlUJJCoadct1B3r.jpg,RU
Smurfs,"When Papa Smurf is mysteriously taken by evil wizards, Razamel and Gargamel, Smurfette leads the Smurfs on a mission into the real world to save him. With the help of new friends, the Smurfs must discover what defines their destiny to save the universe.",2025,Family,Chris Miller,"Rihanna, James Corden, Nick Offerman, JP Karliak, Dan Levy",92,en,https://image.tmdb.org/t/p/w500/8o6lkhL32xQJeB52IIG1us5BVey.jpg,"US, BE"
Snow White,"Following the benevolent King's disappearance, the Evil Queen dominated the once fair land with a cruel streak. Princess Snow White flees the castle when the Queen, in her jealousy over Snow White's inner beauty, tries to kill her. Deep into the dark woods, she stumbles upon seven magical dwarves and a young bandit named Jonathan. Together, they strive to survive the Queen's relentless pursuit and aspire to take back the kingdom.",2025,Family,Marc Webb,"Rachel Zegler, Gal Gadot, Andrew Burnap, Andrew Barth Feldman, Jeremy Swift",109,en,https://image.tmdb.org/t/p/w500/xWWg47tTfparvjK0WJNX4xL8lW2.jpg,US
The Wild Robot,"After a shipwreck, an intelligent robot called Roz is stranded on an uninhabited island. To survive the harsh environment, Roz bonds with the island's animals and cares for an orphaned baby goose.",2024,Family,Chris Sanders,"Lupita Nyong'o, Pedro Pascal, Kit Connor, Bill Nighy, Stephanie Hsu",102,en,https://image.tmdb.org/t/p/w500/wTnV3PCVW5O92JMrFvvrRcV39RU.jpg,US
Woodwalkers,"Humans who can shapeshift into animals struggle to integrate with others without giving away their special abilities. As a group, they strive to inform and institute change in the world perspective of deforestation and the importance of natural habitats. However, when that can’t happen, they are forced to take matters into their own hands.",2024,Family,Damián John Harper,"Emile Chérif, Lilli Falk, Johan von Ehrlich, Sophie Lelenta, Oliver Masucci",103,de,https://image.tmdb.org/t/p/w500/bC1r04ohuxv5feaGDzQ0lXz7Bbl.jpg,"AT, DE, IT"
The Karate Kid,"12-year-old Dre Parker could've been the most popular kid in Detroit, but his mother's latest career move has landed him in China. Dre immediately falls for his classmate Mei Ying but the cultural differences make such a friendship impossible. Even worse, Dre's feelings make him an enemy of the class bully, Cheng. With no friends in a strange land, Dre has nowhere to turn but maintenance man Mr. Han, who is a kung fu master. As Han teaches Dre that kung fu is not about punches and parries, but maturity and calm, Dre realizes that facing down the bullies will be the fight of his life.",2010,Family,Harald Zwart,"Jaden Smith, Jackie Chan, Taraji P. Henson, Wenwen Han, Zac Wang",140,en,https://image.tmdb.org/t/p/w500/b1RBy3l297N0c7PHjlz35cClWju.jpg,"CN, HK, US"
The Old Guard,Four undying warriors who've secretly protected humanity for centuries become targeted for their mysterious powers just as they discover a new immortal.,2020,Fantasy,Gina Prince-Bythewood,"Charlize Theron, KiKi Layne, Veronica Ngo, Matthias Schoenaerts, Marwan Kenzari",125,en,https://image.tmdb.org/t/p/w500/cjr4NWURcVN3gW5FlHeabgBHLrY.jpg,US
Harry Potter and the Prisoner of Azkaban,"Year three at Hogwarts means new fun and challenges as Harry learns the delicate art of approaching a Hippogriff, transforming shape-shifting Boggarts into hilarity and even turning back time. But the term also brings danger: soul-sucking Dementors hover over the school, an ally of the accursed He-Who-Cannot-Be-Named lurks within the castle walls, and fearsome wizard Sirius Black escapes Azkaban. And Harry will confront them all.",2004,Fantasy,Alfonso Cuarón,"Daniel Radcliffe, Rupert Grint, Emma Watson, Robbie Coltrane, Michael Gambon",141,en,https://image.tmdb.org/t/p/w500/aWxwnYoe8p2d2fcxOqtvAtJ72Rw.jpg,"GB, US"
Harry Potter and the Goblet of Fire,"When Harry Potter's name emerges from the Goblet of Fire, he becomes a competitor in a grueling battle for glory among three wizarding schools—the Triwizard Tournament. But since Harry never submitted his name for the Tournament, who did? Now Harry must confront a deadly dragon, fierce water demons and an enchanted maze only to find himself in the cruel grasp of He Who Must Not Be Named.",2005,Fantasy,Mike Newell,"Daniel Radcliffe, Rupert Grint, Emma Watson, Brendan Gleeson, Michael Gambon",157,en,https://image.tmdb.org/t/p/w500/fECBtHlr0RB3foNHDiCBXeg9Bv9.jpg,"GB, US"
Harry Potter and the Order of the Phoenix,"Returning for his fifth year of study at Hogwarts, Harry is stunned to find that his warnings about the return of Lord Voldemort have been ignored. Left with no choice, Harry takes matters into his own hands, training a small group of students to defend themselves against the dark arts.",2007,Fantasy,David Yates,"Daniel Radcliffe, Rupert Grint, Emma Watson, Imelda Staunton, Helena Bonham Carter",138,en,https://image.tmdb.org/t/p/w500/5aOyriWkPec0zUDxmHFP9qMmBaj.jpg,"GB, US"
The Lord of the Rings: The Two Towers,"Frodo Baggins and the other members of the Fellowship continue on their sacred quest to destroy the One Ring--but on separate paths. Their destinies lie at two towers--Orthanc Tower in Isengard, where the corrupt wizard Saruman awaits, and Sauron's fortress at Barad-dur, deep within the dark lands of Mordor. Frodo and Sam are trekking to Mordor to destroy the One Ring of Power while Gimli, Legolas and Aragorn search for the orc-captured Merry and Pippin. All along, nefarious wizard Saruman awaits the Fellowship members at the Orthanc Tower in Isengard.",2002,Fantasy,Peter Jackson,"Elijah Wood, Ian McKellen, Viggo Mortensen, Sean Astin, Andy Serkis",179,en,https://image.tmdb.org/t/p/w500/5VTN0pR8gcqV3EPUHHfMGnJYN9L.jpg,"NZ, US"
Pirates of the Caribbean: At World's End,"Will Turner and Elizabeth Swann join forces with the revived Captain Barbossa to free Jack Sparrow from Davy Jones' locker. The group must navigate dangerous waters, confront many foes and, ultimately, choose sides in a battle wherein piracy itself hangs in the balance.",2007,Fantasy,Gore Verbinski,"Johnny Depp, Geoffrey Rush, Orlando Bloom, Keira Knightley, Jack Davenport",169,en,https://image.tmdb.org/t/p/w500/jGWpG4YhpQwVmjyHEGkxEkeRf0S.jpg,US
Z-O-M-B-I-E-S,"Two star-crossed freshmen – a zombie, Zed and a cheerleader, Addison – each outsiders in their unique ways, befriend each other and work together to show their high school and the Seabrook community what they can achieve when they embrace their differences.",2018,Fantasy,Paul Hoen,"Meg Donnelly, Milo Manheim, Trevor Tordjman, Kylee Russell, Carla Jeffery",94,en,https://image.tmdb.org/t/p/w500/smfvg3SfpkSS0dwCq2C9bhva3A8.jpg,US
Pirates of the Caribbean: Dead Man's Chest,"Captain Jack Sparrow races to recover the heart of Davy Jones to avoid enslaving his soul to Jones' service, as other friends and foes seek the heart for their own agenda as well.",2006,Fantasy,Gore Verbinski,"Johnny Depp, Orlando Bloom, Keira Knightley, Stellan Skarsgård, Bill Nighy",151,en,https://image.tmdb.org/t/p/w500/lAhcKRt0ggTFkeFL95jrGQYaRXs.jpg,US
Harry Potter and the Half-Blood Prince,"As Lord Voldemort tightens his grip on both the Muggle and wizarding worlds, Hogwarts is no longer a safe haven. Harry suspects perils may even lie within the castle, but Dumbledore is more intent upon preparing him for the final battle fast approaching. Together they work to find the key to unlock Voldemorts defenses and to this end, Dumbledore recruits his old friend and colleague Horace Slughorn, whom he believes holds crucial information. Even as the decisive showdown looms, romance blossoms for Harry, Ron, Hermione and their classmates. Love is in the air, but danger lies ahead and Hogwarts may never be the same again.",2009,Fantasy,David Yates,"Daniel Radcliffe, Rupert Grint, Emma Watson, Jim Broadbent, Michael Gambon",153,en,https://image.tmdb.org/t/p/w500/z7uo9zmQdQwU5ZJHFpv2Upl30i1.jpg,"GB, US"
Cells at Work!,"A novice red blood cell and a relentless white blood cell work together to protect their human from invading germs, pathogens and other threats.",2024,Fantasy,Hideki Takeuchi,"Mei Nagano, Takeru Satoh, Mana Ashida, Sadawo Abe, Koji Yamamoto",110,ja,https://image.tmdb.org/t/p/w500/kr67sOdZFPimMYLAmg6eTembFVQ.jpg,JP
The Hobbit: The Battle of the Five Armies,"Following Smaug's attack on Laketown, Bilbo and the dwarves try to defend Erebor's mountain of treasure from others who claim it: the men of the ruined Laketown and the elves of Mirkwood. Meanwhile an army of Orcs led by Azog the Defiler is marching on Erebor, fueled by the rise of the dark lord Sauron. Dwarves, elves and men must unite, and the hope for Middle-Earth falls into Bilbo's hands.",2014,Fantasy,Peter Jackson,"Ian McKellen, Martin Freeman, Richard Armitage, Orlando Bloom, Evangeline Lilly",144,en,https://image.tmdb.org/t/p/w500/xT98tLqatZPQApyRmlPL12LtiWp.jpg,"NZ, US"
