title,summary,year,genre,director,cast,duration,language,poster_url,country
How to Train Your Dragon,"On the rugged isle of Berk, where Vikings and dragons have been bitter enemies for generations, Hiccup stands apart, defying centuries of tradition when he befriends Toothless, a feared Night Fury dragon. Their unlikely bond reveals the true nature of dragons, challenging the very foundations of Viking society.",2025,Action,Dean DeBlois,"Mason Thames, Nico Parker, Gerard Butler, Nick Frost, Gabriel Howell",125,en,https://image.tmdb.org/t/p/w500/q5pXRYTycaeW6dEgsCrd4mYPmxM.jpg,US
Karate Kid: Legends,"After a family tragedy, kung fu prodigy Li Fong is uprooted from his home in Beijing and forced to move to New York City with his mother. When a new friend needs his help, Li enters a karate competition – but his skills alone aren't enough. Li's kung fu teacher Mr. Han enlists original Karate Kid Daniel LaRusso for help, and Li learns a new way to fight, merging their two styles into one for the ultimate martial arts showdown.",2025,Action,Jonathan Entwistle,"Jackie Chan, Ben Wang, Ralph Macchio, Joshua Jackson, Sadie Stanley",94,en,https://image.tmdb.org/t/p/w500/AEgggzRr1vZCLY86MAp93li43z.jpg,US
Man with No Past,"Waking up in an unfamiliar city, a man with no memory must confront the mysteries of his own identity. However, his desperate search to uncover the past pits him against a powerful enemy, leading to a showdown that ultimately reveals the truth.",2025,Action,James Bamford,"Jon Voight, Adam Woodward, Marton Csokas, Charlotte Vega, Philip Winchester",103,en,https://image.tmdb.org/t/p/w500/eWHvROuznSzcxBAAkzX1X0Rmzoe.jpg,US
Almost Cops,"When an overeager community officer and a reckless ex-detective are forced to team up, plenty of chaos ensues on the streets of Rotterdam.",2025,Action,Gonzalo Fernandez Carmona,"Jandino Asporaat, Werner Kolf, Mark Rietman, Florence Vos Weeda, Juliette van Ardenne",95,nl,https://image.tmdb.org/t/p/w500/7bcndiaTgu1Kj5a6qyCmsWYdtI.jpg,NL
Superman,"Superman, a journalist in Metropolis, embarks on a journey to reconcile his Kryptonian heritage with his human upbringing as Clark Kent.",2025,Action,James Gunn,"David Corenswet, Rachel Brosnahan, Nicholas Hoult, Edi Gathegi, Anthony Carrigan",130,en,https://image.tmdb.org/t/p/w500/ombsmhYUqR4qqOLOxAyr5V8hbyv.jpg,US
Ice Road: Vengeance,"Big rig ice road driver Mike McCann travels to Nepal to scatter his late brother’s ashes on Mt. Everest. While on a packed tour bus traversing the deadly 12,000 ft. terrain of the infamous Road to the Sky, McCann and his mountain guide encounter a group of mercenaries and must fight to save themselves, the busload of innocent travelers, and the local villagers’ homeland.",2025,Action,Jonathan Hensleigh,"Liam Neeson, Fan Bingbing, Marcus Thomas, Grace O'Sullivan, Saksham Sharma",113,en,https://image.tmdb.org/t/p/w500/cQN9rZj06rXMVkk76UF1DfBAico.jpg,US
Jurassic World Rebirth,"Five years after the events of Jurassic World Dominion, covert operations expert Zora Bennett is contracted to lead a skilled team on a top-secret mission to secure genetic material from the world's three most massive dinosaurs. When Zora's operation intersects with a civilian family whose boating expedition was capsized, they all find themselves stranded on an island where they come face-to-face with a sinister, shocking discovery that's been hidden from the world for decades.",2025,Action,Gareth Edwards,"Scarlett Johansson, Jonathan Bailey, Mahershala Ali, Rupert Friend, Manuel Garcia-Rulfo",134,en,https://image.tmdb.org/t/p/w500/q0fGCmjLu42MPlSO9OYWpI5w86I.jpg,US
Thunderbolts*,"After finding themselves ensnared in a death trap, seven disillusioned castoffs must embark on a dangerous mission that will force them to confront the darkest corners of their pasts.",2025,Action,Jake Schreier,"Florence Pugh, Sebastian Stan, Julia Louis-Dreyfus, Lewis Pullman, David Harbour",127,en,https://image.tmdb.org/t/p/w500/hqcexYHbiTBfDIdDWxrxPtVndBX.jpg,US
Ziam,"In a fight for survival against a horrifying army of zombies, a former Muay Thai fighter must use skill, speed and grit to save his girlfriend.",2025,Action,Kulp Kaljareuk,"Prin Suparat, Nuttanicha Dungwattanawanich, Wanvayla Boonnithipaisit, Johnny Anfone, Pimmada Boriruksuppakorn",96,th,https://image.tmdb.org/t/p/w500/yHYj2t3NzsjkHVYa0bPri4sMBsg.jpg,TH
Heads of State,"The UK Prime Minister and US President have a public rivalry that risks their countries' alliance. But when they become targets of a powerful enemy, they're forced to rely on each other as they go on a wild, multinational run. Allied with Noel, a brilliant MI6 agent, they must find a way to thwart a conspiracy that threatens the free world.",2025,Action,Ilya Naishuller,"Idris Elba, John Cena, Priyanka Chopra Jonas, Paddy Considine, Carla Gugino",113,en,https://image.tmdb.org/t/p/w500/lVgE5oLzf7ABmzyASEVcjYyHI41.jpg,"US, GB"
KPop Demon Hunters,"When K-pop superstars Rumi, Mira and Zoey aren't selling out stadiums, they're using their secret powers to protect their fans from supernatural threats.",2025,Action,Chris Appelhans,"Arden Cho, May Hong, Ji-young Yoo, Ahn Hyo-seop, Yunjin Kim",96,en,https://image.tmdb.org/t/p/w500/jfS5KEfiwsS35ieZvdUdJKkwLlZ.jpg,US
F1,Racing legend Sonny Hayes is coaxed out of retirement to lead a struggling Formula 1 team—and mentor a young hotshot driver—while chasing one more chance at glory.,2025,Action,Joseph Kosinski,"Brad Pitt, Damson Idris, Javier Bardem, Kerry Condon, Tobias Menzies",156,en,https://image.tmdb.org/t/p/w500/9PXZIUsSDh4alB80jheWX4fhZmy.jpg,US
Muromachi Burai,"Set in war-torn 15th century Kyoto, on the eve of the Onin War, the movie centers on a band of outlaws led by Hyoe (Oizumi) a scoundrel whose lethal sword skills place him at the tip of the spear in a deadly uprising against the corrupt Shogunate and its army, led by former friend-turned-archrival, Doken (Tsutsumi).",2025,Action,Yu Irie,"Yo Oizumi, Kento Nagao, Wakana Matsumoto, Yuya Endo, Tomoya Maeno",135,ja,https://image.tmdb.org/t/p/w500/6U0i0HsSCvhRW4IpGzdead6QRo3.jpg,JP
Mission: Impossible - The Final Reckoning,"Ethan Hunt and team continue their search for the terrifying AI known as the Entity — which has infiltrated intelligence networks all over the globe — with the world's governments and a mysterious ghost from Hunt's past on their trail. Joined by new allies and armed with the means to shut the Entity down for good, Hunt is in a race against time to prevent the world as we know it from changing forever.",2025,Action,Christopher McQuarrie,"Tom Cruise, Hayley Atwell, Ving Rhames, Simon Pegg, Esai Morales",170,en,https://image.tmdb.org/t/p/w500/z53D72EAOxGRqdr7KXXWp9dJiDe.jpg,US
Long Distance,"After crash-landing on an alien planet, an asteroid miner must contend with the challenges of his new surroundings, while making his way across the harsh terrain to the only other survivor – a woman who is trapped in her escape pod.",2024,Action,Josh Gordon,"Anthony Ramos, Naomi Scott, Kristofer Hivju, Zachary Quinto, Izzy Jones",87,en,https://image.tmdb.org/t/p/w500/m5NKltgQqqyoWJNuK18IqEGRG7J.jpg,"US, IN"
First Shift,"NYPD veteran Mike and rookie Angela tackle a high-stakes day on New York's toughest streets, diving headfirst into a vortex of danger and action. Their adrenaline-fueled pursuits and unexpected threats unfold as they navigate perilous encounters. Amidst the chaos, intense challenges forge unbreakable bonds.",2024,Action,Uwe Boll,"Gino Anthony Pesi, Kristen Renton, James McMenamin, Willie C. Carpenter, Daniel Sauli",89,en,https://image.tmdb.org/t/p/w500/ajsGI4JYaciPIe3gPgiJ3Vw5Vre.jpg,US
Crazy Lizard,"A young man climbs into the mountains to pick up a meteorite that has fallen there and is killed by something. The ""thing"" descends to the village and begins to eat the inhabitants one by one, terrorizing the entire island.",2024,Action,Cecil Man Ching Cheng,Sammy Sum,75,zh,https://image.tmdb.org/t/p/w500/9TFaFsSXedaALXTzba349euDeoY.jpg,
Candle in the Tomb: The Worm Valley,"Adapted from the 3rd volume in the novel series ""Candle in the Tomb"" by Zhang Mu Ye. Hu Bayi, Wang Kaixuan, and Shiely Yang, infected with a curse, embark on a journey to King Xian's tomb to retrieve the Haochen Bead and break the curse. They face ancient organs, ghostly visions, explosive bugs, and a massive salamander.",2023,Action,Dai Yilin,"Luo Liqun, Zhang Weiwei, Hu Xue'er, Scotty Cox, Song Jiateng",94,zh,https://image.tmdb.org/t/p/w500/7Hk1qxAvZi9H9cfBb4iHkoGjapH.jpg,CN
A Working Man,"Levon Cade left behind a decorated military career in the black ops to live a simple life working construction. But when his boss's daughter, who is like family to him, is taken by human traffickers, his search to bring her home uncovers a world of corruption far greater than he ever could have imagined.",2025,Action,David Ayer,"Jason Statham, Jason Flemyng, Merab Ninidze, Maximilian Osinski, Cokey Falkow",116,en,https://image.tmdb.org/t/p/w500/6FRFIogh3zFnVWn7Z6zcYnIbRcX.jpg,"GB, US"
Diablo,"Ex-con Kris Chaney seizes the daughter of a Colombian gangster to fulfill a noble promise to the young girl's mother. When her father enlists both the criminal underworld and a psychotic killer to exact his revenge, Kris relies on everything he's ever learned to stay alive and keep his word.",2025,Action,Ernesto Díaz Espinoza,"Scott Adkins, Marko Zaror, Alanna de la Rosa, Diana Hoyos, Lucho Velasco",91,en,https://image.tmdb.org/t/p/w500/uFQduVyYIinJy3eLjozgfl6Xtcn.jpg,US
Predator: Killer of Killers,"While three of the fiercest warriors in human history—a Viking raider, a ninja in feudal Japan, and a WWII pilot—are killers in their own right, they are merely prey for their new opponent: the ultimate killer of killers.",2025,Action,Dan Trachtenberg,"Lindsay LaVanchy, Louis Ozawa, Rick Gonzalez, Michael Biehn, Doug Cockle",85,en,https://image.tmdb.org/t/p/w500/2XDQa6EmFHSA37j1t0w88vpWqj9.jpg,US
Jurassic World Dominion,"Four years after Isla Nublar was destroyed, dinosaurs now live—and hunt—alongside humans all over the world. This fragile balance will reshape the future and determine, once and for all, whether human beings are to remain the apex predators on a planet they now share with history's most fearsome creatures.",2022,Action,Colin Trevorrow,"Chris Pratt, Bryce Dallas Howard, Laura Dern, Sam Neill, Jeff Goldblum",147,en,https://image.tmdb.org/t/p/w500/jbAvCACjLf1ZG0unB2tdmx5HAf1.jpg,US
Captain America: Brave New World,"After meeting with newly elected U.S. President Thaddeus Ross, Sam finds himself in the middle of an international incident. He must discover the reason behind a nefarious global plot before the true mastermind has the entire world seeing red.",2025,Action,Julius Onah,"Anthony Mackie, Harrison Ford, Danny Ramirez, Shira Haas, Tim Blake Nelson",119,en,https://image.tmdb.org/t/p/w500/pzIddUEMWhWzfvLI3TwxUG2wGoi.jpg,US
Deep Cover,"Kat is an improv comedy teacher beginning to question if she’s missed her shot at success. When an undercover cop offers her the role of a lifetime, she recruits two of her students to infiltrate London’s gangland by impersonating dangerous criminals.",2025,Action,Tom Kingsley,"Bryce Dallas Howard, Orlando Bloom, Nick Mohammed, Paddy Considine, Sonoya Mizuno",99,en,https://image.tmdb.org/t/p/w500/1vXTHTbSQJs9r2hp4Uk08XzKwPp.jpg,US
Sonic the Hedgehog 3,"Sonic, Knuckles, and Tails reunite against a powerful new adversary, Shadow, a mysterious villain with powers unlike anything they have faced before. With their abilities outmatched in every way, Team Sonic must seek out an unlikely alliance in hopes of stopping Shadow and protecting the planet.",2024,Action,Jeff Fowler,"Jim Carrey, Ben Schwartz, Keanu Reeves, Idris Elba, Colleen O'Shaughnessey",110,en,https://image.tmdb.org/t/p/w500/d8Ryb8AunYAuycVKDp5HpdWPKgC.jpg,"US, JP"
Hunt the Wicked,"The film tells the story of narcotics police officer Huang Mingjin and the ""mysterious figure"" Wei Yunzhou. Through completely different means and methods, in the process of calculating and wrestling with each other, they tear apart the facade of urban tranquility, exposing the underground drug network woven by the hidden hand ""Long Wang"", and ultimately eradicate the darkness with the sword of justice, revealing the dawn of light.",2024,Action,Chris Huo,"Xie Miao, Andy On, Andrew Lin Hoi, Hong Shuang, Gu Jing",103,zh,https://image.tmdb.org/t/p/w500/m5UBHbEjQJx3AkRZWRY6A4l4ZDT.jpg,CN
Jurassic World,"Twenty-two years after the events of Jurassic Park, Isla Nublar now features a fully functioning dinosaur theme park, Jurassic World, as originally envisioned by John Hammond.",2015,Action,Colin Trevorrow,"Chris Pratt, Bryce Dallas Howard, Irrfan Khan, Vincent D'Onofrio, Ty Simpkins",124,en,https://image.tmdb.org/t/p/w500/rhr4y79GpxQF9IsfJItRXVaoGs4.jpg,US
How to Train Your Dragon 2,"Five years have passed since Hiccup and Toothless united the dragons and Vikings of Berk. Now, they spend their time charting unmapped territories. During one of their adventures, the pair discover a secret cave that houses hundreds of wild dragons -- and a mysterious dragon rider. Hiccup and Toothless find themselves at the center of a battle to protect Berk from a power-hungry warrior.",2014,Action,Dean DeBlois,"Jay Baruchel, Cate Blanchett, Gerard Butler, Craig Ferguson, America Ferrera",102,en,https://image.tmdb.org/t/p/w500/d13Uj86LdbDLrfDoHR5aDOFYyJC.jpg,US
Utopia,"A soldier searching for his missing wife breaks into a high-tech facility, believing she's been caught in a human trafficking ring. But beyond its walls, he finds a surreal, futuristic fantasy park where reality and illusion blur. As he navigates this seductive and dangerous world, a shocking truth pulls him deeper into a deadly game where nothing is as it seems.",2024,Action,James Bamford,"Moe Dunford, Charlotte Vega, Michael D. Xavier, Daniel Bernhardt, Jason Flemyng",93,en,https://image.tmdb.org/t/p/w500/yef0tY1Nw3BX8PJTfBLieqHj5Hw.jpg,US
Jurassic World: Fallen Kingdom,"Three years after Jurassic World was destroyed, Isla Nublar now sits abandoned. When the island's dormant volcano begins roaring to life, Owen and Claire mount a campaign to rescue the remaining dinosaurs from this extinction-level event.",2018,Action,J.A. Bayona,"Chris Pratt, Bryce Dallas Howard, Rafe Spall, Justice Smith, Daniella Pineda",129,en,https://image.tmdb.org/t/p/w500/270MrJNqJovumHXGE6SSt0zwUIF.jpg,US
K.O.,"A former fighter must find the missing son of an opponent he accidentally killed years ago, taking on a brutally violent crime gang in Marseille.",2025,Action,Antoine Blossier,"Ciryl Gane, Alice Belaïdi, Foued Nabba, Maleaume Paquin, Anne Azoulay",84,fr,https://image.tmdb.org/t/p/w500/qcM2sUiAeP4zXwx4ADSvgc9S58k.jpg,"FR, BE"
Venom: The Last Dance,"Eddie and Venom are on the run. Hunted by both of their worlds and with the net closing in, the duo are forced into a devastating decision that will bring the curtains down on Venom and Eddie's last dance.",2024,Action,Kelly Marcel,"Tom Hardy, Chiwetel Ejiofor, Juno Temple, Rhys Ifans, Stephen Graham",109,en,https://image.tmdb.org/t/p/w500/vGXptEdgZIhPg3cGlc7e8sNPC2e.jpg,US
Life After Fighting,"Retired martial arts world champion Alex Faulkner has settled into a simple life, when the disappearance of two of his students leads to an unthinkable discovery close to home. Just when all hope of finding the children is lost, he locates the imprisoned girls and unsurfaces an international child trafficking operation, which draws him back into the fight of his life against those behind it.",2024,Action,Bren Foster,"Bren Foster, Cassie Howarth, Luke Ford, Annabelle Stephenson, Anthony Nassif",126,en,https://image.tmdb.org/t/p/w500/uKWAk4BHzyEOMmLKUDXoIAPhH36.jpg,AU
Kraven the Hunter,"Kraven Kravinoff's complex relationship with his ruthless gangster father, Nikolai, starts him down a path of vengeance with brutal consequences, motivating him to become not only the greatest hunter in the world, but also one of its most feared.",2024,Action,J.C. Chandor,"Aaron Taylor-Johnson, Ariana DeBose, Fred Hechinger, Alessandro Nivola, Christopher Abbott",127,en,https://image.tmdb.org/t/p/w500/i47IUSsN126K11JUzqQIOi1Mg1M.jpg,US
In the Lost Lands,"A queen sends the powerful and feared sorceress Gray Alys to the ghostly wilderness of the Lost Lands in search of a magical power, where she and her guide, the drifter Boyce, must outwit and outfight both man and demon.",2025,Action,Paul W. S. Anderson,"Milla Jovovich, Dave Bautista, Arly Jover, Amara Okereke, Fraser James",102,en,https://image.tmdb.org/t/p/w500/dDlfjR7gllmr8HTeN6rfrYhTdwX.jpg,"DE, CH"
The Avengers,"When an unexpected enemy emerges and threatens global safety and security, Nick Fury, director of the international peacekeeping agency known as S.H.I.E.L.D., finds himself in need of a team to pull the world back from the brink of disaster. Spanning the globe, a daring recruitment effort begins!",2012,Action,Joss Whedon,"Robert Downey Jr., Chris Evans, Mark Ruffalo, Chris Hemsworth, Scarlett Johansson",143,en,https://image.tmdb.org/t/p/w500/RYMX2wcKCBAr24UyPD7xwmjaTn.jpg,US
Shadow Force,"Kyrah and Isaac were once the leaders of a multinational special forces group called Shadow Force. They broke the rules by falling in love, and in order to protect their son, they go underground. With a large bounty on their heads, and the vengeful Shadow Force hot on their trail, one family's fight becomes all-out war.",2025,Action,Joe Carnahan,"Kerry Washington, Omar Sy, Jahleel Kamara, Mark Strong, Da'Vine Joy Randolph",103,en,https://image.tmdb.org/t/p/w500/9LCpHFXZgkqp2AWiYq0mGbfZauk.jpg,US
Superman,"Mild-mannered Clark Kent works as a reporter at the Daily Planet alongside his crush, Lois Lane. Clark must summon his superhero alter-ego when the nefarious Lex Luthor launches a plan to take over the world.",1978,Action,Richard Donner,"Christopher Reeve, Margot Kidder, Gene Hackman, Marlon Brando, Ned Beatty",143,en,https://image.tmdb.org/t/p/w500/d7px1FQxW4tngdACVRsCSaZq0Xl.jpg,"GB, US"
Victoria,"Victoria is a woman betrayed, now on a mission for revenge and destroying anything that gets in her way.",2021,Action,Juan C. Bofill,"Shayna Bofill, Andrei Kopilov, Antoni Corone, Tony Cortez, Yosef Kasnetzkov",20,en,https://image.tmdb.org/t/p/w500/aOSTW7ZitFAff06mZVXUnktejHY.jpg,US
Dora and the Search for Sol Dorado,"Dora, Diego, and their new friends trek through the perilous dangers of the Amazonian jungle in search of the ancient and powerful treasure of Sol Dorado to keep it out of enemy hands.",2025,Adventure,Alberto Belli,"Daniella Pineda, Samantha Lorraine, Jacqueline Obradors, Gabriel Iglesias, Jacob Rodriguez",96,en,https://image.tmdb.org/t/p/w500/r3d6u2n7iPoWNsSWwlJJWrDblOH.jpg,US
Sneaks,"Ty, a misguided, one-of-a-kind designer sneaker, doesn’t know life outside the comforts of his velvet-lined shoebox. After his sister is stolen by a shady collector, Ty must venture into New York City to find and rescue her. In his adventure, Ty meets a ragtag group of footwear friends from all walks of life who help him find the courage to step outside of his shoebox and find his sole-mate.",2025,Adventure,Rob Edwards,"Anthony Mackie, Martin Lawrence, Swae Lee, Chloe Bailey, Macy Gray",93,en,https://image.tmdb.org/t/p/w500/3SipvmtH9VOyLmII9JLs34qFfil.jpg,"US, IN, GB"
The Fantastic Four: First Steps,"Against the vibrant backdrop of a 1960s-inspired, retro-futuristic world, Marvel's First Family is forced to balance their roles as heroes with the strength of their family bond, while defending Earth from a ravenous space god called Galactus and his enigmatic Herald, Silver Surfer.",2025,Adventure,Matt Shakman,"Pedro Pascal, Vanessa Kirby, Joseph Quinn, Ebon Moss-Bachrach, Ralph Ineson",115,en,https://image.tmdb.org/t/p/w500/x26MtUlwtWD26d0G0FXcppxCJio.jpg,US
How to Train Your Dragon,"As the son of a Viking leader on the cusp of manhood, shy Hiccup Horrendous Haddock III faces a rite of passage: he must kill a dragon to prove his warrior mettle. But after downing a feared dragon, he realizes that he no longer wants to destroy it, and instead befriends the beast – which he names Toothless – much to the chagrin of his warrior father.",2010,Adventure,Chris Sanders,"Jay Baruchel, Gerard Butler, Craig Ferguson, America Ferrera, Jonah Hill",98,en,https://image.tmdb.org/t/p/w500/ygGmAO60t8GyqUo9xYeYxSZAR3b.jpg,US
Inside Out 2,"Teenager Riley's mind headquarters is undergoing a sudden demolition to make room for something entirely unexpected: new Emotions! Joy, Sadness, Anger, Fear and Disgust, who’ve long been running a successful operation by all accounts, aren’t sure how to feel when Anxiety shows up. And it looks like she’s not alone.",2024,Adventure,Kelsey Mann,"Amy Poehler, Maya Hawke, Kensington Tallman, Liza Lapira, Tony Hale",97,en,https://image.tmdb.org/t/p/w500/vpnVM9B6NMmQpWeZvzLvDESb2QY.jpg,US
The Unholy Trinity,"Set against the turbulent backdrop of 1870s Montana, in the moments before the execution of Isaac Broadway, he gives his estranged son, Henry, an impossible task: murder the man who framed him for a crime he didn’t commit. Intent on fulfilling his promise, Henry travels to the remote town of Trinity, where an unexpected turn of events traps him in town and leaves him caught between Gabriel Dove, the town’s upstanding new sheriff, and a mysterious figure named St. Christopher.",2025,Adventure,Richard Gray,"Pierce Brosnan, Samuel L. Jackson, Brandon Lessard, Veronica Ferres, Gianni Capaldi",95,en,https://image.tmdb.org/t/p/w500/zSK2sdgeBr41HoKckDZHE4L5zYV.jpg,"US, AU"
Elio,"Elio, a space fanatic with an active imagination, finds himself on a cosmic misadventure where he must form new bonds with eccentric alien lifeforms, navigate a crisis of intergalactic proportions and somehow discover who he is truly meant to be.",2025,Adventure,Madeline Sharafian,"Yonas Kibreab, Zoe Saldaña, Remy Edgerly, Brandon Moon, Brad Garrett",98,en,https://image.tmdb.org/t/p/w500/w2ARwtc1zoh0pyfwmyhpZHwuXgK.jpg,US
Interstellar,The adventures of a group of explorers who make use of a newly discovered wormhole to surpass the limitations on human space travel and conquer the vast distances involved in an interstellar voyage.,2014,Adventure,Christopher Nolan,"Matthew McConaughey, Anne Hathaway, Michael Caine, Jessica Chastain, Casey Affleck",169,en,https://image.tmdb.org/t/p/w500/gEU2QniE6E77NI6lCU6MxlNBvIx.jpg,"GB, US"
Flow,"A solitary cat, displaced by a great flood, finds refuge on a boat with various species and must navigate the challenges of adapting to a transformed world together.",2024,Adventure,Gints Zilbalodis,,85,lv,https://image.tmdb.org/t/p/w500/imKSymKBK7o73sajciEmndJoVkR.jpg,"LV, BE, FR"
Dune: Part Two,"Follow the mythic journey of Paul Atreides as he unites with Chani and the Fremen while on a path of revenge against the conspirators who destroyed his family. Facing a choice between the love of his life and the fate of the known universe, Paul endeavors to prevent a terrible future only he can foresee.",2024,Adventure,Denis Villeneuve,"Timothée Chalamet, Zendaya, Rebecca Ferguson, Javier Bardem, Josh Brolin",167,en,https://image.tmdb.org/t/p/w500/6izwz7rsy95ARzTR3poZ8H6c5pp.jpg,US
Mortal Kombat II,"The fan favorite champions—now joined by Johnny Cage himself—are pitted against one another in the ultimate, no-holds barred, gory battle to defeat the dark rule of Shao Kahn that threatens the very existence of the Earthrealm and its defenders.",2025,Adventure,Simon McQuoid,"Karl Urban, Adeline Rudolph, Jessica McNamee, Josh Lawson, Ludi Lin",0,en,https://image.tmdb.org/t/p/w500/lGamD2f6xEZJSoXlntAd5wvQnWZ.jpg,US
Mission: Impossible - Dead Reckoning Part One,"Ethan Hunt and his IMF team embark on their most dangerous mission yet: To track down a terrifying new weapon that threatens all of humanity before it falls into the wrong hands. With control of the future and the world's fate at stake and dark forces from Ethan's past closing in, a deadly race around the globe begins. Confronted by a mysterious, all-powerful enemy, Ethan must consider that nothing can matter more than his mission—not even the lives of those he cares about most.",2023,Adventure,Christopher McQuarrie,"Tom Cruise, Hayley Atwell, Ving Rhames, Simon Pegg, Rebecca Ferguson",164,en,https://image.tmdb.org/t/p/w500/NNxYkU70HPurnNCSiCjYAmacwm.jpg,US
Batman v Superman: Dawn of Justice,"Fearing the actions of a god-like Super Hero left unchecked, Gotham City’s own formidable, forceful vigilante takes on Metropolis’s most revered, modern-day savior, while the world wrestles with what sort of hero it really needs. And with Batman and Superman at war with one another, a new threat quickly arises, putting mankind in greater danger than it’s ever known before.",2016,Adventure,Zack Snyder,"Ben Affleck, Henry Cavill, Jesse Eisenberg, Gal Gadot, Amy Adams",152,en,https://image.tmdb.org/t/p/w500/5UsK3grJvtQrtzEgqNlDljJW96w.jpg,US
Barbie,"Barbie and Ken are having the time of their lives in the colorful and seemingly perfect world of Barbie Land. However, when they get a chance to go to the real world, they soon discover the joys and perils of living among humans.",2023,Adventure,Greta Gerwig,"Margot Robbie, Ryan Gosling, America Ferrera, Ariana Greenblatt, Issa Rae",114,en,https://image.tmdb.org/t/p/w500/iuFNMS8U5cb6xfzi51Dbkovj7vM.jpg,"GB, US"
