title,summary,year,genre,director,cast,duration,language,poster_url,country
Trolls,"After the monstrous Bergens invade Troll Village, Princess Poppy, the happiest Troll ever born, and overly-cautious, curmudgeonly outcast Branch set off on a journey to rescue her friends. Their mission is full of adventure and mishaps, as this mismatched duo try to tolerate each other long enough to get the job done.",2016,Music,Mike Mitchell,"Anna Kendrick, Justin Timberlake, Zooey Deschanel, Christopher Mintz-Plasse, Christine Baranski",92,en,https://image.tmdb.org/t/p/w500/9VlK2j0THZWzhQPq0W3Oc0IIdBB.jpg,US
A Man Called Adam,A famous jazz trumpeter finds himself unable to cope with the problems of everyday life.,1966,Music,Leo Penn,"Sammy Davis Jr., Ossie Davis, Cicely Tyson, Louis Armstrong, Frank Sinatra Jr.",99,en,https://image.tmdb.org/t/p/w500/lQQnlbhgFRCBmtuh1Lq42oBE1im.jpg,US
A Star Is Born,"Seasoned musician Jackson Maine discovers — and falls in love with — struggling artist Ally. She has just about given up on her dream to make it big as a singer — until Jack coaxes her into the spotlight. But even as Ally's career takes off, the personal side of their relationship is breaking down, as Jack fights an ongoing battle with his own internal demons.",2018,Music,Bradley Cooper,"Lady Gaga, Bradley Cooper, Sam Elliott, Andrew Dice Clay, Rafi Gavron",136,en,https://image.tmdb.org/t/p/w500/wrFpXMNBRj2PBiN4Z5kix51XaIZ.jpg,US
Dreamgirls,"A trio of female soul singers cross over to the pop charts in the early 1960s, facing their own personal struggles along the way.",2006,Music,Bill Condon,"Jamie Foxx, Beyoncé, Eddie Murphy, Danny Glover, Jennifer Hudson",130,en,https://image.tmdb.org/t/p/w500/sG5JyOj8Spe13QkNJMH8b5kzQUh.jpg,US
Alvin and the Chipmunks: The Squeakquel,"Pop sensations Alvin, Simon and Theodore end up in the care of Dave Seville's twenty-something nephew Toby. The boys must put aside music super stardom to return to school, and are tasked with saving the school's music program by winning the $25,000 prize in a battle of the bands. But the Chipmunks unexpectedly meet their match in three singing chipmunks known as The Chipettes - Brittany, Eleanor and Jeanette. Romantic and musical sparks are ignited when the Chipmunks and Chipettes square off.",2009,Music,Betty Thomas,"Zachary Levi, David Cross, Jason Lee, Justin Long, Matthew Gray Gubler",88,en,https://image.tmdb.org/t/p/w500/8mdPqOga5fty15nXmaNcK1fsNMa.jpg,US
Descendants 2,"When the pressure to be royal becomes too much for Mal, she returns to the Isle of the Lost where her archenemy Uma, Ursula's daughter, has taken her spot as self-proclaimed queen.",2017,Music,Kenny Ortega,"Dove Cameron, Cameron Boyce, Sofia Carson, Booboo Stewart, Mitchell Hope",111,en,https://image.tmdb.org/t/p/w500/qoNlGfQmFZ37Gf5fRBaCTLlOZtx.jpg,US
Get Rich or Die Tryin',"A tale of an inner city drug dealer who turns away from crime to pursue his passion, rap music.",2005,Music,Jim Sheridan,"50 Cent, Joy Bryant, Adewale Akinnuoye-Agbaje, Omar Benson Miller, Terrence Howard",117,en,https://image.tmdb.org/t/p/w500/aaEJu8vFKtrAoSRtw3xjCf1aM5d.jpg,US
A Song Is Born,The story of seven scholars in search of an expert to teach them about swing music. They seem to have found the perfect candidate in winsome nightclub singer Honey Swanson. But Honey's gangster boyfriend doesn't want to give her up.,1948,Music,Howard Hawks,"Danny Kaye, Virginia Mayo, Benny Goodman, Tommy Dorsey, Louis Armstrong",113,en,https://image.tmdb.org/t/p/w500/aSAR6nbRbAWOdcXz51LQsrMsTjS.jpg,US
Cheer Up,"An impoverished team of composer and songwriter try to secure financial backing for their new musical, with the assistance of a struggling actress working as a housemaid.",1936,Music,Leo Mittler,"Stanley Lupino, Sally Gray, Roddy Hughes, Gerald Barry, Kenneth Kove",72,en,https://image.tmdb.org/t/p/w500/9krHbHhOk4kwXfSTlQiG83LoOfe.jpg,GB
Cabaret,"Inside the Kit Kat Club of 1931 Berlin, starry-eyed singer Sally Bowles and an impish emcee sound the clarion call to decadent fun, while outside a certain political party grows into a brutal force.",1972,Music,Bob Fosse,"Liza Minnelli, Michael York, Helmut Griem, Joel Grey, Fritz Wepper",124,en,https://image.tmdb.org/t/p/w500/fMhOeJ2TvuY46iYGmsowhgRXfnr.jpg,"DE, US"
How Great Thou Art,"This unforgettable gathering will capture the hearts of young and old alike and is a keepsake for families who long to pass along the Old, Old Story from generation to generation.",2007,Music,,"Bill Gaither, Mark Lowry",94,en,https://image.tmdb.org/t/p/w500/87L5UKOxDBhk4ohA7kgyajqKE6D.jpg,US
The Ballad of Wallis Island,An eccentric lottery winner who lives alone on a remote island tries to make his fantasies come true by getting his favourite musicians to perform at his home.,2025,Music,James Griffiths,"Tom Basden, Tim Key, Carey Mulligan, Sian Clifford, Akemnji Ndifornyen",100,en,https://image.tmdb.org/t/p/w500/AhmJOYdUn9katXqDk0ZpZanQ0xp.jpg,"GB, US"
The Ballad of Buster Scruggs,"Vignettes weaving together the stories of six individuals in the old West at the end of the Civil War. Following the tales of a sharp-shooting songster, a wannabe bank robber, two weary traveling performers, a lone gold prospector, a woman traveling the West to an uncertain future, and a motley crew of strangers undertaking a carriage ride.",2018,Music,Joel Coen,"Tim Blake Nelson, Willie Watson, Clancy Brown, Danny McCarthy, David Krumholtz",132,en,https://image.tmdb.org/t/p/w500/voxl654m7p36y8FLu8oQD7dfwwK.jpg,US
Revival,"Like a spark that ignites the grasslands, revival seems to come from nowhere and spreads across the wastelands of the human heart; it buns away the hulls and stubble, and come spring, new life sprouts from the charred waste! Songs of revival are the most exciting of all. They have energy. They have power to move us to tears and make us shout for the sheer joy of being truly alive. This Gaither Homecoming video will recall for the times when God's presence invaded your dry places and suddenly you knew 'resurrection' was more than just a word.",2007,Music,,"Sue Dodge, Bill Gaither, Gloria Gaither",88,en,https://image.tmdb.org/t/p/w500/Aiasn5RPfgHicthFgxMd7qcrOno.jpg,US
School of Rock,"Fired from his band and hard up for cash, guitarist and vocalist Dewey Finn finagles his way into a job as a fifth-grade substitute teacher at a private school, where he secretly begins teaching his students the finer points of rock 'n' roll. The school's hard-nosed principal is rightly suspicious of Finn's activities. But Finn's roommate remains in the dark about what he's doing.",2003,Music,Richard Linklater,"Jack Black, Joan Cusack, Mike White, Sarah Silverman, Miranda Cosgrove",110,en,https://image.tmdb.org/t/p/w500/zXLXaepIBvFVLU25DH3wv4IPSbe.jpg,US
Israel Homecoming,"In an historic first for Bill and Gloria Gaither and their Homecoming Friends, Jerusalem -- the Holy City of God -- plays host for a moving videotaped visit to the cradle of Christianity. The concert was staged in David's Citadel, part of the original city of Jerusalem, and one of the most unique and sacred venues in the world. The entire countryside where Jesus lived, walked and died is showcased with stirring performances at the Garden Tomb, the Southern Steps and the Jordan River.",2005,Music,,"Gloria Gaither, Bill Gaither, Guy Penrod, Ben Speer",100,en,https://image.tmdb.org/t/p/w500/mJSGH1nCGZdPtOiW3hEjuVLkDPX.jpg,
The Maze Runner,"Set in a post-apocalyptic world, young Thomas is deposited in a community of boys after his memory is erased, soon learning they're all trapped in a maze that will require him to join forces with fellow “runners” for a shot at escape.",2014,Mystery,Wes Ball,"Dylan O'Brien, Kaya Scodelario, Aml Ameen, Thomas Brodie-Sangster, Ki Hong Lee",113,en,https://image.tmdb.org/t/p/w500/ode14q7WtDugFDp78fo9lCsmay9.jpg,"US, GB"
Gone Girl,"With his wife's disappearance having become the focus of an intense media circus, a man sees the spotlight turned on him when it's suspected that he may not be innocent.",2014,Mystery,David Fincher,"Ben Affleck, Rosamund Pike, Neil Patrick Harris, Tyler Perry, Carrie Coon",149,en,https://image.tmdb.org/t/p/w500/ts996lKsxvjkO2yiYG0ht4qAicO.jpg,US
The Devil's Advocate,"Aspiring Florida defense lawyer Kevin Lomax accepts a job at a New York law firm. With the stakes getting higher every case, Kevin quickly learns that his boss has something far more evil planned.",1997,Mystery,Taylor Hackford,"Keanu Reeves, Al Pacino, Charlize Theron, Jeffrey Jones, Judith Ivey",144,en,https://image.tmdb.org/t/p/w500/5ZzBGpxy55OQzHxKVY11IpY6a0o.jpg,"DE, US"
"It's Called 'Murder', Baby","In 1940s Los Angeles, private investigator Nick Popodopolis, is hired by actress Dixie Ray, to find her blackmailer.  Edited R version of adult film, Dixie Ray Hollywood Star.",1983,Mystery,Anthony Spinelli,"John Leslie, Juliet Anderson, Veronica Hart, Kelly Nichols, Samantha Fox",94,en,https://image.tmdb.org/t/p/w500/3t0AGedAVSiVOu8614okkVRyU1i.jpg,US
The Sixth Sense,"Following an unexpected tragedy, child psychologist Malcolm Crowe meets a nine year old boy named Cole Sear, who is hiding a dark secret.",1999,Mystery,M. Night Shyamalan,"Bruce Willis, Haley Joel Osment, Toni Collette, Olivia Williams, Donnie Wahlberg",107,en,https://image.tmdb.org/t/p/w500/vOyfUXNFSnaTk7Vk5AjpsKTUWsu.jpg,US
Black Bag,"When intelligence agent Kathryn Woodhouse is suspected of betraying the nation, her husband – also a legendary agent – faces the ultimate test of whether to be loyal to his marriage, or his country.",2025,Mystery,Steven Soderbergh,"Cate Blanchett, Michael Fassbender, Tom Burke, Marisa Abela, Regé-Jean Page",94,en,https://image.tmdb.org/t/p/w500/hHPovtU4b96LHcoeEwRkGHI5btw.jpg,US
Eyes Wide Shut,"After Dr. Bill Harford's wife, Alice, admits to having sexual fantasies about a man she met, Bill becomes obsessed with having a sexual encounter. He discovers an underground sexual group and attends one of their meetings -- and quickly discovers that he is in over his head.",1999,Mystery,Stanley Kubrick,"Tom Cruise, Nicole Kidman, Sydney Pollack, Marie Richardson, Rade Šerbedžija",159,en,https://image.tmdb.org/t/p/w500/knEIz1eNGl5MQDbrEAVWA7iRqF9.jpg,"GB, US"
A Widow's Game,"When a man is found dead, the investigation shatters his widow's perfect facade and exposes a hidden double life in this thriller based on real events.",2025,Mystery,Carlos Sedes,"Ivana Baquero, Tristán Ulloa, Carmen Machi, Pepe Ocio, Joel Sánchez",122,es,https://image.tmdb.org/t/p/w500/yZOdrJDl2GwREoigC0y40kMosxj.jpg,ES
Knives Out,"When renowned crime novelist Harlan Thrombey is found dead at his estate just after his 85th birthday, the inquisitive and debonair Detective Benoit Blanc is mysteriously enlisted to investigate. From Harlan's dysfunctional family to his devoted staff, Blanc sifts through a web of red herrings and self-serving lies to uncover the truth behind Harlan's untimely death.",2019,Mystery,Rian Johnson,"Daniel Craig, Chris Evans, Ana de Armas, Jamie Lee Curtis, Michael Shannon",131,en,https://image.tmdb.org/t/p/w500/pThyQovXQrw2m0s9x82twj48Jq4.jpg,US
Salt,"As a CIA officer, Evelyn Salt swore an oath to duty, honor and country. Her loyalty will be tested when a Russian defector accuses her of being a Russian sleeper spy. She goes on the run, using all her skills and years of experience as a covert operative to elude capture, protect her husband, and stay one step ahead of her colleagues at the CIA. Her efforts to prove her innocence only serve to cast doubt on her motives, as the hunt to uncover the truth behind her identity continues and the question remains: ""Who is Salt?""",2010,Mystery,Phillip Noyce,"Angelina Jolie, Liev Schreiber, Chiwetel Ejiofor, Daniel Olbrychski, August Diehl",100,en,https://image.tmdb.org/t/p/w500/ppXyhOe8UCEOrBRSYqE3SkHwrcR.jpg,US
Skin. Like. Sun.,"Real-life young couple Wim and Floor spend an afternoon in the sunwashed rooms of a crumbling home in Belgium. In a unique twist, this artistic erotic documentary is edited in nearly real-time. In the slowness, we get the build, the sweetness, and the sexiness. Forget about fingersnapping fast editing. Slow is where it’s at.",2009,Romance,Jennifer Lyon Bell,"Wim van Damme, Floor Wyns",60,fr,https://image.tmdb.org/t/p/w500/uCkANtG6ezb7hjRKVudY3PUcbvn.jpg,"NL, BE"
given the Movie: To the Sea,"Mafuyu doubts his place in the band, but a familiar face could be the spark that brings him back to the stage.",2024,Romance,Noriko Hashimoto,"Shogo Yano, Yuma Uchida, Masatomo Nakazawa, Takuya Eguchi, Fumiya Imai",80,ja,https://image.tmdb.org/t/p/w500/2VLnT5JtJ77ErG6GD3c1J628VLp.jpg,JP
Couple Exchange,"Nan-hee, who wants to enjoy her newlywed life, feels something wrong with her husband, Moo-yeong's body. No matter how much she tries to seduce him every night, Moo-yeong is unable to use his strength. One day, Nan-hee's high school classmate Yoo-na moves in next door. Nan-hee begins to heal Moo-yeong through Yoo-na's shocking suggestion.",2023,Romance,Jang Kwon,"Min Jo-ah, Do Hee, Min Do-yoon, Sang Woo, Lee Soo",90,ko,https://image.tmdb.org/t/p/w500/7WFlsCBnVyVfJxZWprAkU4poCaJ.jpg,KR
Materialists,"A young, ambitious New York City matchmaker finds herself torn between the perfect match and her imperfect ex.",2025,Romance,Celine Song,"Dakota Johnson, Chris Evans, Pedro Pascal, Zoë Winters, Marin Ireland",116,en,https://image.tmdb.org/t/p/w500/eDo0pNruy0Qgj6BdTyHIR4cxHY8.jpg,"FI, US"
Fifty Shades of Grey,"When college senior Anastasia Steele steps in for her sick roommate to interview prominent businessman Christian Grey for their campus paper, little does she realize the path her life will take. Christian, as enigmatic as he is rich and powerful, finds himself strangely drawn to Ana, and she to him. Though sexually inexperienced, Ana plunges headlong into an affair -- and learns that Christian's true sexual proclivities push the boundaries of pain and pleasure.",2015,Romance,Sam Taylor-Johnson,"Dakota Johnson, Jamie Dornan, Jennifer Ehle, Eloise Mumford, Victor Rasuk",125,en,https://image.tmdb.org/t/p/w500/63kGofUkt1Mx0SIL4XI4Z5AoSgt.jpg,US
Kalakal,"A seductive female garbage collector who embraces the life of an escort lady. Desperate to live a comfortable life, she leaves the dumpsite and enters the club. But can she also dump both her brother and her lover who remind her of her past?",2025,Romance,Roman Perez Jr.,"Aliya Raymundo, Gold Aceron, Jero Flores, Divine Villareal, Zel Fernandez",0,tl,https://image.tmdb.org/t/p/w500/KwhyuZn24FOs4Dl52g9KLpS48a.jpg,PH
Me Before You,"A small town girl is caught between dead-end jobs. A high-profile, successful man becomes wheelchair bound following an accident. The man decides his life is not worth living until the girl is hired for six months to be his new caretaker. Worlds apart and trapped together by circumstance, the two get off to a rocky start. But the girl becomes determined to prove to the man that life is worth living and as they embark on a series of adventures together, each finds their world changing in ways neither of them could begin to imagine.",2016,Romance,Thea Sharrock,"Emilia Clarke, Sam Claflin, Janet McTeer, Charles Dance, Brendan Coyle",110,en,https://image.tmdb.org/t/p/w500/Ia3dzj5LnCj1ZBdlVeJrbKJQxG.jpg,US
Ghosted,"Salt-of-the-earth Cole falls head over heels for enigmatic Sadie—but then makes the shocking discovery that she's a secret agent. Before they can decide on a second date, Cole and Sadie are swept away on an international adventure to save the world.",2023,Romance,Dexter Fletcher,"Chris Evans, Ana de Armas, Adrien Brody, Mike Moh, Amy Sedaris",117,en,https://image.tmdb.org/t/p/w500/liLN69YgoovHVgmlHJ876PKi5Yi.jpg,US
14 and Under,"This episodic film is a close relative of Wolf Hartwig's schoolgirl report movies, made by the same people, in a similar style, around similar topics. However, this one specifically focuses on the coming-of-age aspects, to an extent that it also touches on delicate issues such as paedophilia.",1973,Romance,Ernst Hofbauer,"Harald Baerow, Ulrike Butz, Elke Deuringer, Sonja Embriz, Marisa Feldy",87,de,https://image.tmdb.org/t/p/w500/sreO7KKeh6s99jYFl9XzpxDkOeZ.jpg,DE
Hotel Desire,"Antonia is a single mother who works as a hotel maid in Berlin. A normal hot summer day takes a dramatic turn when she crosses paths with a particular guest of the hotel, famous blind portrait painter Julius Pass.",2011,Romance,Sergej Moya,"Saralisa Volm, Clemens Schick, Jan-Gregor Kremp, Herbert Knaup, Palina Rojinski",38,de,https://image.tmdb.org/t/p/w500/myzQj8Rk178DrWsiZjVKjz7Kj9P.jpg,DE
Sipsipan,"At Sipsipan, a shady stop where truckers trade fuel for cash and pleasure, one man’s craving leads him down a path of lust, lies, and no return.",2025,Romance,Rodante Pajemna Jr.,"Micaella Raz, Lea Bernabe, Astrid Lee, JC Tan, Mark Dionisio",70,tl,https://image.tmdb.org/t/p/w500/s8L60mdRK3aBhu9EjXFAvc0KiSQ.jpg,PH
Fifty Shades Freed,"Believing they have left behind shadowy figures from their past, newlyweds Christian and Ana fully embrace an inextricable connection and shared life of luxury. But just as she steps into her role as Mrs. Grey and he relaxes into an unfamiliar stability, new threats could jeopardize their happy ending before it even begins.",2018,Romance,James Foley,"Dakota Johnson, Jamie Dornan, Eric Johnson, Eloise Mumford, Rita Ora",105,en,https://image.tmdb.org/t/p/w500/jjPJ4s3DWZZvI4vw8Xfi4Vqa1Q8.jpg,US
The Wedding Banquet,"Frustrated with his commitment-phobic boyfriend Chris and running out of time, Min makes a proposal: a green-card marriage with their friend Angela in exchange for her partner Lee's expensive IVF. Elopement plans are upended, however, when Min's grandmother surprises them with an extravagant Korean wedding banquet.",2025,Romance,Andrew Ahn,"Bowen Yang, Lily Gladstone, Kelly Marie Tran, Han Gi-chan, Joan Chen",103,en,https://image.tmdb.org/t/p/w500/48scEvAG0H4PBWTt86sJeazExpN.jpg,US
Sidelined: The QB and Me,"Dallas, a burdened but headstrong dancer, is determined to get into the best dance school in the country—her late mother’s alma mater. However, that dream is suddenly derailed when the cheeky yet secretly grieving football star, Drayton, crashes into her life with a unique story of his own. Will the two of them be able to grow into their dreams together, or will their dreams be sidelined?",2025,Romance,Justin Wu,"Siena Agudong, Noah Beck, Drew Ray Tanner, James Van Der Beek, Deborah Cox",99,en,https://image.tmdb.org/t/p/w500/mSL6truNrWP1Bn9ng1rN0SkMI4f.jpg,CA
Meet Joe Black,"Bill Parrish has it all - success, wealth and power. Days before his 65th birthday, he receives a visit from a mysterious stranger, Joe Black, who soon reveals himself as Death. In exchange for extra time, Bill agrees to serve as Joe's earthly guide. But will he regret his choice when Joe unexpectedly falls in love with Bill's beautiful daughter Susan?",1998,Romance,Martin Brest,"Brad Pitt, Anthony Hopkins, Claire Forlani, Jake Weber, Marcia Gay Harden",178,en,https://image.tmdb.org/t/p/w500/fDPAjvfPMomkKF7cMRmL5Anak61.jpg,US
Corpse Bride,"In a 19th-century European village, a young man about to be married is whisked away to the underworld and wed to a mysterious corpse bride, while his real bride waits bereft in the land of the living.",2005,Romance,Mike Johnson,"Johnny Depp, Helena Bonham Carter, Emily Watson, Tracey Ullman, Paul Whitehouse",77,en,https://image.tmdb.org/t/p/w500/isb2Qow76GpqYmsSyfdMfsYAjts.jpg,"GB, US"
The Handmaiden,"1930s Korea, in the period of Japanese occupation, a new girl, Sookee, is hired as a handmaiden to a Japanese heiress, Hideko, who lives a secluded life on a large countryside estate with her domineering Uncle Kouzuki. But the maid has a secret. She is a pickpocket recruited by a swindler posing as a Japanese Count to help him seduce the Lady to elope with him, rob her of her fortune, and lock her up in a madhouse. The plan seems to proceed according to plan until Sookee and Hideko discover some unexpected emotions.",2016,Romance,Park Chan-wook,"Kim Min-hee, Kim Tae-ri, Ha Jung-woo, Cho Jin-woong, Kim Hae-sook",145,ko,https://image.tmdb.org/t/p/w500/dLlH4aNHdnmf62umnInL8xPlPzw.jpg,KR
Bosomy Mom,"Da-hee gets married to Min-soo who is older than her. Thanks to him, he also gets a son who is not too old, Jae-hyuk, who she tries to get acquainted with, albeit awkwardly. After staying with Na-yeon, she suddenly has to meet Jae-hyuk, and Na-yeon has a date with Jae-hyuk. Min-soo is surprised to find three people coming back home from a date. It made him angry to see his son with two women. Right away, Min-soo seeks Da-hee and asks about Na-yeon. Na-yeon met Min-soo secretly. However, Da-hee who is aware of Min-soo and Da-hee's relationship, shares this fact to Jae-hyun.",2020,Romance,Lee Dong-Joon,"Yoo Jung, Han Yi-seul, James, Shin Yeon-woo",69,ko,https://image.tmdb.org/t/p/w500/zarhMAQRWKjjsNBR1rviIXZ5xtt.jpg,KR
Hidden Desire,"David is sitting in a bar, musing over why he has bedded and left five or six of Asia's loveliest women in such a short time.",1991,Romance,Ho Fan,"Veronica Yip Yuk-Hing, Rena Murakami, Sharon Kwok, Charlie Cho Cha-Lee, Ho Pak-Kwong",78,cn,https://image.tmdb.org/t/p/w500/39cD7X07Nrt3wsEqcYP1n9BhjX2.jpg,HK
The Fault in Our Stars,"Despite the tumor-shrinking medical miracle that has bought her a few years, Hazel has never been anything but terminal, her final chapter inscribed upon diagnosis. But when a patient named Augustus Waters suddenly appears at Cancer Kid Support Group, Hazel's story is about to be completely rewritten.",2014,Romance,Josh Boone,"Shailene Woodley, Ansel Elgort, Nat Wolff, Laura Dern, Sam Trammell",126,en,https://image.tmdb.org/t/p/w500/ep7dF4QR4Mm39LI958V0XbwE0hK.jpg,US
Transformers: Rise of the Beasts,"When a new threat capable of destroying the entire planet emerges, Optimus Prime and the Autobots must team up with a powerful faction known as the Maximals. With the fate of humanity hanging in the balance, humans Noah and Elena will do whatever it takes to help the Transformers as they engage in the ultimate battle to save Earth.",2023,Science Fiction,Steven Caple Jr.,"Anthony Ramos, Dominique Fishback, Peter Cullen, Ron Perlman, Peter Dinklage",127,en,https://image.tmdb.org/t/p/w500/gPbM0MK8CP8A174rmUwGsADNYKD.jpg,US
Avatar: The Way of Water,"Set more than a decade after the events of the first film, learn the story of the Sully family (Jake, Neytiri, and their kids), the trouble that follows them, the lengths they go to keep each other safe, the battles they fight to stay alive, and the tragedies they endure.",2022,Science Fiction,James Cameron,"Sam Worthington, Zoe Saldaña, Sigourney Weaver, Stephen Lang, Kate Winslet",192,en,https://image.tmdb.org/t/p/w500/t6HIqrRAclMCA60NsSmeqe9RmNV.jpg,US
Iron Man 2,"With the world now aware of his dual life as the armored superhero Iron Man, billionaire inventor Tony Stark faces pressure from the government, the press and the public to share his technology with the military. Unwilling to let go of his invention, Stark, with Pepper Potts and James 'Rhodey' Rhodes at his side, must forge new alliances – and confront powerful enemies.",2010,Science Fiction,Jon Favreau,"Robert Downey Jr., Gwyneth Paltrow, Don Cheadle, Scarlett Johansson, Sam Rockwell",124,en,https://image.tmdb.org/t/p/w500/6WBeq4fCfn7AN0o21W9qNcRF2l9.jpg,US
Star Wars,Princess Leia is captured and held hostage by the evil Imperial forces in their effort to take over the galactic Empire. Venturesome Luke Skywalker and dashing captain Han Solo team together with the loveable robot duo R2-D2 and C-3PO to rescue the beautiful princess and restore peace and justice in the Empire.,1977,Science Fiction,George Lucas,"Mark Hamill, Harrison Ford, Carrie Fisher, Peter Cushing, Alec Guinness",121,en,https://image.tmdb.org/t/p/w500/6FfCtAuVAW8XJjZ7eWeLibRLWTw.jpg,US
Guardians of the Galaxy Vol. 3,"Peter Quill, still reeling from the loss of Gamora, must rally his team around him to defend the universe along with protecting one of their own. A mission that, if not completed successfully, could quite possibly lead to the end of the Guardians as we know them.",2023,Science Fiction,James Gunn,"Chris Pratt, Zoe Saldaña, Dave Bautista, Karen Gillan, Pom Klementieff",150,en,https://image.tmdb.org/t/p/w500/r2J02Z2OpNTctfOSN1Ydgii51I3.jpg,US
Godzilla x Kong: The New Empire,"Following their explosive showdown, Godzilla and Kong must reunite against a colossal undiscovered threat hidden within our world, challenging their very existence – and our own.",2024,Science Fiction,Adam Wingard,"Rebecca Hall, Brian Tyree Henry, Dan Stevens, Kaylee Hottle, Alex Ferns",115,en,https://image.tmdb.org/t/p/w500/z1p34vh7dEOnLDmyCrlUVLuoDzd.jpg,US
Avengers: Endgame,"After the devastating events of Avengers: Infinity War, the universe is in ruins due to the efforts of the Mad Titan, Thanos. With the help of remaining allies, the Avengers must assemble once more in order to undo Thanos' actions and restore order to the universe once and for all, no matter what consequences may be in store.",2019,Science Fiction,Anthony Russo,"Robert Downey Jr., Chris Evans, Mark Ruffalo, Chris Hemsworth, Scarlett Johansson",181,en,https://image.tmdb.org/t/p/w500/ulzhLuWrPK07P1YkdWQLZnQh1JL.jpg,US
The Flash,"When his attempt to save his family inadvertently alters the future, Barry Allen becomes trapped in a reality in which General Zod has returned and there are no Super Heroes to turn to. In order to save the world that he is in and return to the future that he knows, Barry's only hope is to race for his life. But will making the ultimate sacrifice be enough to reset the universe?",2023,Science Fiction,Andy Muschietti,"Ezra Miller, Sasha Calle, Michael Keaton, Michael Shannon, Ron Livingston",144,en,https://image.tmdb.org/t/p/w500/rktDFPbfHfUbArZ6OOOKsXcv0Bm.jpg,US
